QCM,À quelle température l’eau pure passe-t-elle de l’état solide à l’état liquide (à pression normale) ?,-100 °C,0 °C,50 °C,100 °C,0 °C
QCM,Que se passe-t-il lorsque la température d’un corps augmente ?,Les molécules se déplacent moins.,Les molécules se déplacent davantage.,Les molécules changent de composition.,Les molécules se transforment en atomes.,Les molécules se déplacent davantage.
QCM,L’eau pure entre en ébullition à une température de :,0 °C,50 °C,100 °C,150 °C,100 °C
QCM,Quel matériau est un bon conducteur thermique ?,Le bois,Le plastique,Le métal,La laine,Le métal
QCM,À quelle température le fer fond-il ?,100 °C,500 °C,1 500 °C,5 000 °C,1 500 °C
QCM,Un corps noir est un objet qui :,Reflet la lumière.,Absorbe toute la lumière et la chaleur qui l’atteint.,Reflète toute la lumière et absorbe uniquement la chaleur.,N’absorbe ni lumière ni chaleur.,Absorbe toute la lumière et la chaleur qui l’atteint.
QCM,L’échelle de température qui utilise le zéro absolu est :,Celsius.,Fahrenheit.,Kelvin.,Rankine.,Kelvin.
